<?xml version="1.0" encoding="UTF-8"?>
<tns:geppettoModel xmlns:tns="http://www.openworm.org/simulationSchema" xmlns:xsi="http://www.w3.org/2001/XMLSchema-instance" xsi:schemaLocation="http://www.openworm.org/simulationSchema ../../main/resources/schema/simulation/simulationSchema.xsd">
	<tns:entity>
		<tns:id>sample</tns:id>
		<tns:aspect>
			<tns:id>fluid</tns:id>
			<tns:model>
    				<tns:modelInterpreterId>sphModelInterpreter</tns:modelInterpreterId>
    				<tns:modelURL>/projects/SPHLiquidSmall/sphModel_liquid_780.xml</tns:modelURL>
			</tns:model>
		</tns:aspect>		
	</tns:entity>	
</tns:geppettoModel>
